{
  "id": "d530ed0a-2b9a-4748-8d98-e9d278cd12e4",
  "description": "This example represents a double glazing with photovoltaic cells in the laminated glass pane facing the exterior. It includes optical properties which are needed for raytracing simulations.",
  "categories": {
    "componentType": ["unit"]
  },
  "characteristics": {
    "roughness": [
      {
        "surface": "nonPrime",
        "rootMeanSquare": 0.2
      }
    ]
  },
  "optical": [
    {
      "id": {
        "value": "a8435146-5270-46f5-b925-4b00de265823",
        "issuedBy": "5320d6fb-b96d-4aeb-a24c-eb7036d3437a"
      },
      "description": "Example: Nearnormal-nearnormal and nearnormal-hemispherical reflectance for red, green and blue.",
      "data": [
        {
          "data": [
            {
              "dataPoints": [
                {
                  "incidence": {
                    "direction": {
                      "polar": 8
                    },
                    "wavelengths": {
                      "wavelength": 430
                    }
                  },
                  "emergence": {
                    "direction": {
                      "polar": 8
                    }
                  },
                  "results": {
                    "reflectance": 0.1
                  }
                },
                {
                  "incidence": {
                    "direction": {
                      "polar": 8
                    },
                    "wavelengths": {
                      "wavelength": 540
                    }
                  },
                  "emergence": {
                    "direction": {
                      "polar": 8
                    }
                  },
                  "results": {
                    "reflectance": 0.1
                  }
                },
                {
                  "incidence": {
                    "direction": {
                      "polar": 8
                    },
                    "wavelengths": {
                      "wavelength": 570
                    }
                  },
                  "emergence": {
                    "direction": {
                      "polar": 8
                    }
                  },
                  "results": {
                    "reflectance": 0.1
                  }
                },
                {
                  "incidence": {
                    "direction": {
                      "polar": 8
                    },
                    "wavelengths": {
                      "wavelength": 430
                    }
                  },
                  "emergence": {
                    "direction": "hemispherical"
                  },
                  "results": {
                    "reflectance": 0.1
                  }
                },
                {
                  "incidence": {
                    "direction": {
                      "polar": 8
                    },
                    "wavelengths": {
                      "wavelength": 540
                    }
                  },
                  "emergence": {
                    "direction": "hemispherical"
                  },
                  "results": {
                    "reflectance": 0.1
                  }
                },
                {
                  "incidence": {
                    "direction": {
                      "polar": 8
                    },
                    "wavelengths": {
                      "wavelength": 570
                    }
                  },
                  "emergence": {
                    "direction": "hemispherical"
                  },
                  "results": {
                    "reflectance": 0.1
                  }
                }
              ]
            }
          ]
        }
      ]
    }
  ],
  "calorimetric": [
    {
      "data": [
        {
          "results": [
            {
              "area": {
                "category": "outerDimensions"
              },
              "uValue": 1.23,
              "gValue": {
                "uncertainValue": 0.5,
                "uncertainty": 0.1,
                "confidenceInterval": 68.3
              }
            }
          ]
        }
      ]
    }
  ],
  "photovoltaic": [
    {
      "data": [
        {
          "module": {
            "cellTypes": [
              {
                "id": "b0d2b769-74d8-46ab-a3b7-16bb52ac4c60",
                "width": 0.156,
                "categories": ["monocrystalline", "silicon"]
              }
            ],
            "cellPattern": {
              "rectangular": {
                "longitudinal": {
                  "cellNumber": 10
                },
                "transversal": {
                  "cellNumber": 6
                }
              }
            },
            "cells": [
              {
                "id": {
                  "value": "764ca288-0c51-11ea-8d71-362b9e155667",
                  "issuedBy": "5320d6fb-b96d-4aeb-a24c-eb7036d3437a"
                },
                "cellType": {
                  "value": "b0d2b769-74d8-46ab-a3b7-16bb52ac4c60",
                  "issuedBy": "5320d6fb-b96d-4aeb-a24c-eb7036d3437a"
                }
              },
              {
                "id": {
                  "value": "764ca508-0c51-11ea-8d71-362b9e155667",
                  "issuedBy": "5320d6fb-b96d-4aeb-a24c-eb7036d3437a"
                },
                "cellType": {
                  "value": "b0d2b769-74d8-46ab-a3b7-16bb52ac4c60",
                  "issuedBy": "5320d6fb-b96d-4aeb-a24c-eb7036d3437a"
                }
              }
            ],
            "connectionPattern": "series",
            "electricConfiguration": {
              "junctionBoxTypes": [
                {
                  "id": "6a5083af-7bee-491c-b3fd-d6229f6a56ec"
                }
              ],
              "connectorTypes": [
                {
                  "id": "7c43b619-402f-4309-b66f-5672b8ca071d"
                }
              ],
              "connectors": [
                {
                  "id": "14838e0b-e17b-4c52-8578-fb2cc9170ac4",
                  "connectorType": "411249fc-14c7-4940-805b-15dc0855b444",
                  "junctionBoxType": "538a6419-aecd-45c1-8e61-8dd4d3e74988"
                }
              ],
              "groundingNecessary": false
            },
            "moduleProperties": {
              "power": {
                "nominal": 260,
                "temperatureCoefficient": -0.32,
                "guarantees": [
                  {
                    "years": 10,
                    "percentage": 90
                  },
                  {
                    "years": 15,
                    "percentage": 80
                  }
                ],
                "angleDependency": [
                  {
                    "incidence": 0,
                    "incidenceAngleModifier": 1
                  },
                  {
                    "incidence": 60,
                    "incidenceAngleModifier": 0.924
                  },
                  {
                    "incidence": 90,
                    "incidenceAngleModifier": 0
                  }
                ]
              },
              "efficiency": 0.16
            }
          }
        }
      ]
    }
  ]
}
